<?xml version="1.0" ?>
<!DOCTYPE main [
  <!ELEMENT main (DATA_RECORD*)>
  <!ELEMENT DATA_RECORD (NICK_NAME,NOMBRE?,FECHA,FOTO?)+>
  <!ELEMENT NICK_NAME (#PCDATA)>
  <!ELEMENT NOMBRE (#PCDATA)>
  <!ELEMENT FECHA (#PCDATA)>
  <!ELEMENT FOTO (#PCDATA)>
]>
<main>
  <DATA_RECORD>
    <NICK_NAME>SKING</NICK_NAME>
    <NOMBRE>Steven King</NOMBRE>
    <FECHA>2003/06/17 00:00:00</FECHA>
    <FOTO>C:\IMAGENES\SKING.jpg</FOTO>
  </DATA_RECORD>
  <DATA_RECORD>
    <NICK_NAME>NKOCHHAR</NICK_NAME>
    <NOMBRE>Neena Kochhar</NOMBRE>
    <FECHA>2005/09/21 00:00:00</FECHA>
    <FOTO>C:\IMAGENES\NKOCHHAR.jpg</FOTO>
  </DATA_RECORD>
  <DATA_RECORD>
    <NICK_NAME>LDEHAAN</NICK_NAME>
    <NOMBRE>Lex De Haan</NOMBRE>
    <FECHA>2001/01/13 00:00:00</FECHA>
    <FOTO>C:\IMAGENES\LDEHAAN.jpg</FOTO>
  </DATA_RECORD>
  <DATA_RECORD>
    <NICK_NAME>AHUNOLD</NICK_NAME>
    <NOMBRE>Alexander Hunold</NOMBRE>
    <FECHA>2006/01/03 00:00:00</FECHA>
    <FOTO>C:\IMAGENES\AHUNOLD.jpg</FOTO>
  </DATA_RECORD>
  <DATA_RECORD>
    <NICK_NAME>BERNST</NICK_NAME>
    <NOMBRE>Bruce Ernst</NOMBRE>
    <FECHA>2007/05/21 00:00:00</FECHA>
    <FOTO>C:\IMAGENES\BERNST.jpg</FOTO>
  </DATA_RECORD>
  <DATA_RECORD>
    <NICK_NAME>DAUSTIN</NICK_NAME>
    <NOMBRE>David Austin</NOMBRE>
    <FECHA>2005/06/25 00:00:00</FECHA>
    <FOTO>C:\IMAGENES\DAUSTIN.jpg</FOTO>
  </DATA_RECORD>
  <DATA_RECORD>
    <NICK_NAME>VPATABAL</NICK_NAME>
    <NOMBRE>Valli Pataballa</NOMBRE>
    <FECHA>2006/02/05 00:00:00</FECHA>
    <FOTO>C:\IMAGENES\VPATABAL.jpg</FOTO>
  </DATA_RECORD>
  <DATA_RECORD>
    <NICK_NAME>DLORENTZ</NICK_NAME>
    <NOMBRE>Diana Lorentz</NOMBRE>
    <FECHA>2007/02/07 00:00:00</FECHA>
    <FOTO>C:\IMAGENES\DLORENTZ.jpg</FOTO>
  </DATA_RECORD>
  <DATA_RECORD>
    <NICK_NAME>NGREENBE</NICK_NAME>
    <NOMBRE>Nancy Greenberg</NOMBRE>
    <FECHA>2002/08/17 00:00:00</FECHA>
    <FOTO>C:\IMAGENES\NGREENBE.jpg</FOTO>
  </DATA_RECORD>
  <DATA_RECORD>
    <NICK_NAME>DFAVIET</NICK_NAME>
    <NOMBRE>Daniel Faviet</NOMBRE>
    <FECHA>2002/08/16 00:00:00</FECHA>
    <FOTO>C:\IMAGENES\DFAVIET.jpg</FOTO>
  </DATA_RECORD>
  <DATA_RECORD>
    <NICK_NAME>JCHEN</NICK_NAME>
    <NOMBRE>John Chen</NOMBRE>
    <FECHA>2005/09/28 00:00:00</FECHA>
    <FOTO>C:\IMAGENES\JCHEN.jpg</FOTO>
  </DATA_RECORD>
  <DATA_RECORD>
    <NICK_NAME>ISCIARRA</NICK_NAME>
    <NOMBRE>Ismael Sciarra</NOMBRE>
    <FECHA>2005/09/30 00:00:00</FECHA>
    <FOTO>C:\IMAGENES\ISCIARRA.jpg</FOTO>
  </DATA_RECORD>
  <DATA_RECORD>
    <NICK_NAME>JMURMAN</NICK_NAME>
    <NOMBRE>Jose Manuel Urman</NOMBRE>
    <FECHA>2006/03/07 00:00:00</FECHA>
    <FOTO>C:\IMAGENES\JMURMAN.jpg</FOTO>
  </DATA_RECORD>
  <DATA_RECORD>
    <NICK_NAME>LPOPP</NICK_NAME>
    <NOMBRE>Luis Popp</NOMBRE>
    <FECHA>2007/12/07 00:00:00</FECHA>
    <FOTO>C:\IMAGENES\LPOPP.jpg</FOTO>
  </DATA_RECORD>
  <DATA_RECORD>
    <NICK_NAME>DRAPHEAL</NICK_NAME>
    <NOMBRE>Den Raphaely</NOMBRE>
    <FECHA>2002/12/07 00:00:00</FECHA>
    <FOTO>C:\IMAGENES\DRAPHEAL.jpg</FOTO>
  </DATA_RECORD>
  <DATA_RECORD>
    <NICK_NAME>AKHOO</NICK_NAME>
    <NOMBRE>Alexander Khoo</NOMBRE>
    <FECHA>2003/05/18 00:00:00</FECHA>
    <FOTO>C:\IMAGENES\AKHOO.jpg</FOTO>
  </DATA_RECORD>
  <DATA_RECORD>
    <NICK_NAME>SBAIDA</NICK_NAME>
    <NOMBRE>Shelli Baida</NOMBRE>
    <FECHA>2005/12/24 00:00:00</FECHA>
    <FOTO>C:\IMAGENES\SBAIDA.jpg</FOTO>
  </DATA_RECORD>
  <DATA_RECORD>
    <NICK_NAME>STOBIAS</NICK_NAME>
    <NOMBRE>Sigal Tobias</NOMBRE>
    <FECHA>2005/07/24 00:00:00</FECHA>
    <FOTO>C:\IMAGENES\STOBIAS.jpg</FOTO>
  </DATA_RECORD>
  <DATA_RECORD>
    <NICK_NAME>GHIMURO</NICK_NAME>
    <NOMBRE>Guy Himuro</NOMBRE>
    <FECHA>2006/11/15 00:00:00</FECHA>
    <FOTO>C:\IMAGENES\GHIMURO.jpg</FOTO>
  </DATA_RECORD>
  <DATA_RECORD>
    <NICK_NAME>KCOLMENA</NICK_NAME>
    <NOMBRE>Karen Colmenares</NOMBRE>
    <FECHA>2007/08/10 00:00:00</FECHA>
    <FOTO>C:\IMAGENES\KCOLMENA.jpg</FOTO>
  </DATA_RECORD>
  <DATA_RECORD>
    <NICK_NAME>MWEISS</NICK_NAME>
    <NOMBRE>Matthew Weiss</NOMBRE>
    <FECHA>2004/07/18 00:00:00</FECHA>
    <FOTO>C:\IMAGENES\MWEISS.jpg</FOTO>
  </DATA_RECORD>
  <DATA_RECORD>
    <NICK_NAME>AFRIPP</NICK_NAME>
    <NOMBRE>Adam Fripp</NOMBRE>
    <FECHA>2005/04/10 00:00:00</FECHA>
    <FOTO>C:\IMAGENES\AFRIPP.jpg</FOTO>
  </DATA_RECORD>
  <DATA_RECORD>
    <NICK_NAME>PKAUFLIN</NICK_NAME>
    <NOMBRE>Payam Kaufling</NOMBRE>
    <FECHA>2003/05/01 00:00:00</FECHA>
    <FOTO>C:\IMAGENES\PKAUFLIN.jpg</FOTO>
  </DATA_RECORD>
  <DATA_RECORD>
    <NICK_NAME>SVOLLMAN</NICK_NAME>
    <NOMBRE>Shanta Vollman</NOMBRE>
    <FECHA>2005/10/10 00:00:00</FECHA>
    <FOTO>C:\IMAGENES\SVOLLMAN.jpg</FOTO>
  </DATA_RECORD>
  <DATA_RECORD>
    <NICK_NAME>KMOURGOS</NICK_NAME>
    <NOMBRE>Kevin Mourgos</NOMBRE>
    <FECHA>2007/11/16 00:00:00</FECHA>
    <FOTO>C:\IMAGENES\KMOURGOS.jpg</FOTO>
  </DATA_RECORD>
  <DATA_RECORD>
    <NICK_NAME>JNAYER</NICK_NAME>
    <NOMBRE>Julia Nayer</NOMBRE>
    <FECHA>2005/07/16 00:00:00</FECHA>
    <FOTO>C:\IMAGENES\JNAYER.jpg</FOTO>
  </DATA_RECORD>
  <DATA_RECORD>
    <NICK_NAME>IMIKKILI</NICK_NAME>
    <NOMBRE>Irene Mikkilineni</NOMBRE>
    <FECHA>2006/09/28 00:00:00</FECHA>
    <FOTO>C:\IMAGENES\IMIKKILI.jpg</FOTO>
  </DATA_RECORD>
  <DATA_RECORD>
    <NICK_NAME>JLANDRY</NICK_NAME>
    <NOMBRE>James Landry</NOMBRE>
    <FECHA>2007/01/14 00:00:00</FECHA>
    <FOTO>C:\IMAGENES\JLANDRY.jpg</FOTO>
  </DATA_RECORD>
  <DATA_RECORD>
    <NICK_NAME>SMARKLE</NICK_NAME>
    <NOMBRE>Steven Markle</NOMBRE>
    <FECHA>2008/03/08 00:00:00</FECHA>
    <FOTO>C:\IMAGENES\SMARKLE.jpg</FOTO>
  </DATA_RECORD>
  <DATA_RECORD>
    <NICK_NAME>LBISSOT</NICK_NAME>
    <NOMBRE>Laura Bissot</NOMBRE>
    <FECHA>2005/08/20 00:00:00</FECHA>
    <FOTO>C:\IMAGENES\LBISSOT.jpg</FOTO>
  </DATA_RECORD>
  <DATA_RECORD>
    <NICK_NAME>MATKINSO</NICK_NAME>
    <NOMBRE>Mozhe Atkinson</NOMBRE>
    <FECHA>2005/10/30 00:00:00</FECHA>
    <FOTO>C:\IMAGENES\MATKINSO.jpg</FOTO>
  </DATA_RECORD>
  <DATA_RECORD>
    <NICK_NAME>JAMRLOW</NICK_NAME>
    <NOMBRE>James Marlow</NOMBRE>
    <FECHA>2005/02/16 00:00:00</FECHA>
    <FOTO>C:\IMAGENES\JAMRLOW.jpg</FOTO>
  </DATA_RECORD>
  <DATA_RECORD>
    <NICK_NAME>TJOLSON</NICK_NAME>
    <NOMBRE>TJ Olson</NOMBRE>
    <FECHA>2007/04/10 00:00:00</FECHA>
    <FOTO>C:\IMAGENES\TJOLSON.jpg</FOTO>
  </DATA_RECORD>
  <DATA_RECORD>
    <NICK_NAME>JMALLIN</NICK_NAME>
    <NOMBRE>Jason Mallin</NOMBRE>
    <FECHA>2004/06/14 00:00:00</FECHA>
    <FOTO>C:\IMAGENES\JMALLIN.jpg</FOTO>
  </DATA_RECORD>
  <DATA_RECORD>
    <NICK_NAME>MROGERS</NICK_NAME>
    <NOMBRE>Michael Rogers</NOMBRE>
    <FECHA>2006/08/26 00:00:00</FECHA>
    <FOTO>C:\IMAGENES\MROGERS.jpg</FOTO>
  </DATA_RECORD>
  <DATA_RECORD>
    <NICK_NAME>KGEE</NICK_NAME>
    <NOMBRE>Ki Gee</NOMBRE>
    <FECHA>2007/12/12 00:00:00</FECHA>
    <FOTO>C:\IMAGENES\KGEE.jpg</FOTO>
  </DATA_RECORD>
  <DATA_RECORD>
    <NICK_NAME>HPHILTAN</NICK_NAME>
    <NOMBRE>Hazel Philtanker</NOMBRE>
    <FECHA>2008/02/06 00:00:00</FECHA>
    <FOTO>C:\IMAGENES\HPHILTAN.jpg</FOTO>
  </DATA_RECORD>
  <DATA_RECORD>
    <NICK_NAME>RLADWIG</NICK_NAME>
    <NOMBRE>Renske Ladwig</NOMBRE>
    <FECHA>2003/07/14 00:00:00</FECHA>
    <FOTO>C:\IMAGENES\RLADWIG.jpg</FOTO>
  </DATA_RECORD>
  <DATA_RECORD>
    <NICK_NAME>SSTILES</NICK_NAME>
    <NOMBRE>Stephen Stiles</NOMBRE>
    <FECHA>2005/10/26 00:00:00</FECHA>
    <FOTO>C:\IMAGENES\SSTILES.jpg</FOTO>
  </DATA_RECORD>
  <DATA_RECORD>
    <NICK_NAME>JSEO</NICK_NAME>
    <NOMBRE>John Seo</NOMBRE>
    <FECHA>2006/02/12 00:00:00</FECHA>
    <FOTO>C:\IMAGENES\JSEO.jpg</FOTO>
  </DATA_RECORD>
  <DATA_RECORD>
    <NICK_NAME>JPATEL</NICK_NAME>
    <NOMBRE>Joshua Patel</NOMBRE>
    <FECHA>2006/04/06 00:00:00</FECHA>
    <FOTO>C:\IMAGENES\JPATEL.jpg</FOTO>
  </DATA_RECORD>
  <DATA_RECORD>
    <NICK_NAME>TRAJS</NICK_NAME>
    <NOMBRE>Trenna Rajs</NOMBRE>
    <FECHA>2003/10/17 00:00:00</FECHA>
    <FOTO>C:\IMAGENES\TRAJS.jpg</FOTO>
  </DATA_RECORD>
  <DATA_RECORD>
    <NICK_NAME>CDAVIES</NICK_NAME>
    <NOMBRE>Curtis Davies</NOMBRE>
    <FECHA>2005/01/29 00:00:00</FECHA>
    <FOTO>C:\IMAGENES\CDAVIES.jpg</FOTO>
  </DATA_RECORD>
  <DATA_RECORD>
    <NICK_NAME>RMATOS</NICK_NAME>
    <NOMBRE>Randall Matos</NOMBRE>
    <FECHA>2006/03/15 00:00:00</FECHA>
    <FOTO>C:\IMAGENES\RMATOS.jpg</FOTO>
  </DATA_RECORD>
  <DATA_RECORD>
    <NICK_NAME>PVARGAS</NICK_NAME>
    <NOMBRE>Peter Vargas</NOMBRE>
    <FECHA>2006/07/09 00:00:00</FECHA>
    <FOTO>C:\IMAGENES\PVARGAS.jpg</FOTO>
  </DATA_RECORD>
  <DATA_RECORD>
    <NICK_NAME>JRUSSEL</NICK_NAME>
    <NOMBRE>John Russell</NOMBRE>
    <FECHA>2004/10/01 00:00:00</FECHA>
    <FOTO>C:\IMAGENES\JRUSSEL.jpg</FOTO>
  </DATA_RECORD>
  <DATA_RECORD>
    <NICK_NAME>KPARTNER</NICK_NAME>
    <NOMBRE>Karen Partners</NOMBRE>
    <FECHA>2005/01/05 00:00:00</FECHA>
    <FOTO>C:\IMAGENES\KPARTNER.jpg</FOTO>
  </DATA_RECORD>
  <DATA_RECORD>
    <NICK_NAME>AERRAZUR</NICK_NAME>
    <NOMBRE>Alberto Errazuriz</NOMBRE>
    <FECHA>2005/03/10 00:00:00</FECHA>
    <FOTO>C:\IMAGENES\AERRAZUR.jpg</FOTO>
  </DATA_RECORD>
  <DATA_RECORD>
    <NICK_NAME>GCAMBRAU</NICK_NAME>
    <NOMBRE>Gerald Cambrault</NOMBRE>
    <FECHA>2007/10/15 00:00:00</FECHA>
    <FOTO>C:\IMAGENES\GCAMBRAU.jpg</FOTO>
  </DATA_RECORD>
  <DATA_RECORD>
    <NICK_NAME>EZLOTKEY</NICK_NAME>
    <NOMBRE>Eleni Zlotkey</NOMBRE>
    <FECHA>2008/01/29 00:00:00</FECHA>
    <FOTO>C:\IMAGENES\EZLOTKEY.jpg</FOTO>
  </DATA_RECORD>
  <DATA_RECORD>
    <NICK_NAME>PTUCKER</NICK_NAME>
    <NOMBRE>Peter Tucker</NOMBRE>
    <FECHA>2005/01/30 00:00:00</FECHA>
    <FOTO>C:\IMAGENES\PTUCKER.jpg</FOTO>
  </DATA_RECORD>
  <DATA_RECORD>
    <NICK_NAME>DBERNSTE</NICK_NAME>
    <NOMBRE>David Bernstein</NOMBRE>
    <FECHA>2005/03/24 00:00:00</FECHA>
    <FOTO>C:\IMAGENES\DBERNSTE.jpg</FOTO>
  </DATA_RECORD>
  <DATA_RECORD>
    <NICK_NAME>PHALL</NICK_NAME>
    <NOMBRE>Peter Hall</NOMBRE>
    <FECHA>2005/08/20 00:00:00</FECHA>
    <FOTO>C:\IMAGENES\PHALL.jpg</FOTO>
  </DATA_RECORD>
  <DATA_RECORD>
    <NICK_NAME>COLSEN</NICK_NAME>
    <NOMBRE>Christopher Olsen</NOMBRE>
    <FECHA>2006/03/30 00:00:00</FECHA>
    <FOTO>C:\IMAGENES\COLSEN.jpg</FOTO>
  </DATA_RECORD>
  <DATA_RECORD>
    <NICK_NAME>NCAMBRAU</NICK_NAME>
    <NOMBRE>Nanette Cambrault</NOMBRE>
    <FECHA>2006/12/09 00:00:00</FECHA>
    <FOTO>C:\IMAGENES\NCAMBRAU.jpg</FOTO>
  </DATA_RECORD>
  <DATA_RECORD>
    <NICK_NAME>OTUVAULT</NICK_NAME>
    <NOMBRE>Oliver Tuvault</NOMBRE>
    <FECHA>2007/11/23 00:00:00</FECHA>
    <FOTO>C:\IMAGENES\OTUVAULT.jpg</FOTO>
  </DATA_RECORD>
  <DATA_RECORD>
    <NICK_NAME>JKING</NICK_NAME>
    <NOMBRE>Janette King</NOMBRE>
    <FECHA>2004/01/30 00:00:00</FECHA>
    <FOTO>C:\IMAGENES\JKING.jpg</FOTO>
  </DATA_RECORD>
  <DATA_RECORD>
    <NICK_NAME>PSULLY</NICK_NAME>
    <NOMBRE>Patrick Sully</NOMBRE>
    <FECHA>2004/03/04 00:00:00</FECHA>
    <FOTO>C:\IMAGENES\PSULLY.jpg</FOTO>
  </DATA_RECORD>
  <DATA_RECORD>
    <NICK_NAME>AMCEWEN</NICK_NAME>
    <NOMBRE>Allan McEwen</NOMBRE>
    <FECHA>2004/08/01 00:00:00</FECHA>
    <FOTO>C:\IMAGENES\AMCEWEN.jpg</FOTO>
  </DATA_RECORD>
  <DATA_RECORD>
    <NICK_NAME>LSMITH</NICK_NAME>
    <NOMBRE>Lindsey Smith</NOMBRE>
    <FECHA>2005/03/10 00:00:00</FECHA>
    <FOTO>C:\IMAGENES\LSMITH.jpg</FOTO>
  </DATA_RECORD>
  <DATA_RECORD>
    <NICK_NAME>LDORAN</NICK_NAME>
    <NOMBRE>Louise Doran</NOMBRE>
    <FECHA>2005/12/15 00:00:00</FECHA>
    <FOTO>C:\IMAGENES\LDORAN.jpg</FOTO>
  </DATA_RECORD>
  <DATA_RECORD>
    <NICK_NAME>SSEWALL</NICK_NAME>
    <NOMBRE>Sarath Sewall</NOMBRE>
    <FECHA>2006/11/03 00:00:00</FECHA>
    <FOTO>C:\IMAGENES\SSEWALL.jpg</FOTO>
  </DATA_RECORD>
  <DATA_RECORD>
    <NICK_NAME>CVISHNEY</NICK_NAME>
    <NOMBRE>Clara Vishney</NOMBRE>
    <FECHA>2005/11/11 00:00:00</FECHA>
    <FOTO>C:\IMAGENES\CVISHNEY.jpg</FOTO>
  </DATA_RECORD>
  <DATA_RECORD>
    <NICK_NAME>DGREENE</NICK_NAME>
    <NOMBRE>Danielle Greene</NOMBRE>
    <FECHA>2007/03/19 00:00:00</FECHA>
    <FOTO>C:\IMAGENES\DGREENE.jpg</FOTO>
  </DATA_RECORD>
  <DATA_RECORD>
    <NICK_NAME>MMARVINS</NICK_NAME>
    <NOMBRE>Mattea Marvins</NOMBRE>
    <FECHA>2008/01/24 00:00:00</FECHA>
    <FOTO>C:\IMAGENES\MMARVINS.jpg</FOTO>
  </DATA_RECORD>
  <DATA_RECORD>
    <NICK_NAME>DLEE</NICK_NAME>
    <NOMBRE>David Lee</NOMBRE>
    <FECHA>2008/02/23 00:00:00</FECHA>
    <FOTO>C:\IMAGENES\DLEE.jpg</FOTO>
  </DATA_RECORD>
  <DATA_RECORD>
    <NICK_NAME>SANDE</NICK_NAME>
    <NOMBRE>Sundar Ande</NOMBRE>
    <FECHA>2008/03/24 00:00:00</FECHA>
    <FOTO>C:\IMAGENES\SANDE.jpg</FOTO>
  </DATA_RECORD>
  <DATA_RECORD>
    <NICK_NAME>ABANDA</NICK_NAME>
    <NOMBRE>Amit Banda</NOMBRE>
    <FECHA>2008/04/21 00:00:00</FECHA>
    <FOTO>C:\IMAGENES\ABANDA.jpg</FOTO>
  </DATA_RECORD>
  <DATA_RECORD>
    <NICK_NAME>LOZER</NICK_NAME>
    <NOMBRE>Lisa Ozer</NOMBRE>
    <FECHA>2005/03/11 00:00:00</FECHA>
    <FOTO>C:\IMAGENES\LOZER.jpg</FOTO>
  </DATA_RECORD>
  <DATA_RECORD>
    <NICK_NAME>HBLOOM</NICK_NAME>
    <NOMBRE>Harrison Bloom</NOMBRE>
    <FECHA>2006/03/23 00:00:00</FECHA>
    <FOTO>C:\IMAGENES\HBLOOM.jpg</FOTO>
  </DATA_RECORD>
  <DATA_RECORD>
    <NICK_NAME>TFOX</NICK_NAME>
    <NOMBRE>Tayler Fox</NOMBRE>
    <FECHA>2006/01/24 00:00:00</FECHA>
    <FOTO>C:\IMAGENES\TFOX.jpg</FOTO>
  </DATA_RECORD>
  <DATA_RECORD>
    <NICK_NAME>WSMITH</NICK_NAME>
    <NOMBRE>William Smith</NOMBRE>
    <FECHA>2007/02/23 00:00:00</FECHA>
    <FOTO>C:\IMAGENES\WSMITH.jpg</FOTO>
  </DATA_RECORD>
  <DATA_RECORD>
    <NICK_NAME>EBATES</NICK_NAME>
    <NOMBRE>Elizabeth Bates</NOMBRE>
    <FECHA>2007/03/24 00:00:00</FECHA>
    <FOTO>C:\IMAGENES\EBATES.jpg</FOTO>
  </DATA_RECORD>
  <DATA_RECORD>
    <NICK_NAME>SKUMAR</NICK_NAME>
    <NOMBRE>Sundita Kumar</NOMBRE>
    <FECHA>2008/04/21 00:00:00</FECHA>
    <FOTO>C:\IMAGENES\SKUMAR.jpg</FOTO>
  </DATA_RECORD>
  <DATA_RECORD>
    <NICK_NAME>EABEL</NICK_NAME>
    <NOMBRE>Ellen Abel</NOMBRE>
    <FECHA>2004/05/11 00:00:00</FECHA>
    <FOTO>C:\IMAGENES\EABEL.jpg</FOTO>
  </DATA_RECORD>
  <DATA_RECORD>
    <NICK_NAME>AHUTTON</NICK_NAME>
    <NOMBRE>Alyssa Hutton</NOMBRE>
    <FECHA>2005/03/19 00:00:00</FECHA>
    <FOTO>C:\IMAGENES\AHUTTON.jpg</FOTO>
  </DATA_RECORD>
  <DATA_RECORD>
    <NICK_NAME>JTAYLOR</NICK_NAME>
    <NOMBRE>Jonathon Taylor</NOMBRE>
    <FECHA>2006/03/24 00:00:00</FECHA>
    <FOTO>C:\IMAGENES\JTAYLOR.jpg</FOTO>
  </DATA_RECORD>
  <DATA_RECORD>
    <NICK_NAME>JLIVINGS</NICK_NAME>
    <NOMBRE>Jack Livingston</NOMBRE>
    <FECHA>2006/04/23 00:00:00</FECHA>
    <FOTO>C:\IMAGENES\JLIVINGS.jpg</FOTO>
  </DATA_RECORD>
  <DATA_RECORD>
    <NICK_NAME>KGRANT</NICK_NAME>
    <NOMBRE>Kimberely Grant</NOMBRE>
    <FECHA>2007/05/24 00:00:00</FECHA>
    <FOTO>C:\IMAGENES\KGRANT.jpg</FOTO>
  </DATA_RECORD>
  <DATA_RECORD>
    <NICK_NAME>CJOHNSON</NICK_NAME>
    <NOMBRE>Charles Johnson</NOMBRE>
    <FECHA>2008/01/04 00:00:00</FECHA>
    <FOTO>C:\IMAGENES\CJOHNSON.jpg</FOTO>
  </DATA_RECORD>
  <DATA_RECORD>
    <NICK_NAME>WTAYLOR</NICK_NAME>
    <NOMBRE>Winston Taylor</NOMBRE>
    <FECHA>2006/01/24 00:00:00</FECHA>
    <FOTO>C:\IMAGENES\WTAYLOR.jpg</FOTO>
  </DATA_RECORD>
  <DATA_RECORD>
    <NICK_NAME>JFLEAUR</NICK_NAME>
    <NOMBRE>Jean Fleaur</NOMBRE>
    <FECHA>2006/02/23 00:00:00</FECHA>
    <FOTO>C:\IMAGENES\JFLEAUR.jpg</FOTO>
  </DATA_RECORD>
  <DATA_RECORD>
    <NICK_NAME>MSULLIVA</NICK_NAME>
    <NOMBRE>Martha Sullivan</NOMBRE>
    <FECHA>2007/06/21 00:00:00</FECHA>
    <FOTO>C:\IMAGENES\MSULLIVA.jpg</FOTO>
  </DATA_RECORD>
  <DATA_RECORD>
    <NICK_NAME>GGEONI</NICK_NAME>
    <NOMBRE>Girard Geoni</NOMBRE>
    <FECHA>2008/02/03 00:00:00</FECHA>
    <FOTO>C:\IMAGENES\GGEONI.jpg</FOTO>
  </DATA_RECORD>
  <DATA_RECORD>
    <NICK_NAME>NSARCHAN</NICK_NAME>
    <NOMBRE>Nandita Sarchand</NOMBRE>
    <FECHA>2004/01/27 00:00:00</FECHA>
    <FOTO>C:\IMAGENES\NSARCHAN.jpg</FOTO>
  </DATA_RECORD>
  <DATA_RECORD>
    <NICK_NAME>ABULL</NICK_NAME>
    <NOMBRE>Alexis Bull</NOMBRE>
    <FECHA>2005/02/20 00:00:00</FECHA>
    <FOTO>C:\IMAGENES\ABULL.jpg</FOTO>
  </DATA_RECORD>
  <DATA_RECORD>
    <NICK_NAME>JDELLING</NICK_NAME>
    <NOMBRE>Julia Dellinger</NOMBRE>
    <FECHA>2006/06/24 00:00:00</FECHA>
    <FOTO>C:\IMAGENES\JDELLING.jpg</FOTO>
  </DATA_RECORD>
  <DATA_RECORD>
    <NICK_NAME>ACABRIO</NICK_NAME>
    <NOMBRE>Anthony Cabrio</NOMBRE>
    <FECHA>2007/02/07 00:00:00</FECHA>
    <FOTO>C:\IMAGENES\ACABRIO.jpg</FOTO>
  </DATA_RECORD>
  <DATA_RECORD>
    <NICK_NAME>KCHUNG</NICK_NAME>
    <NOMBRE>Kelly Chung</NOMBRE>
    <FECHA>2005/06/14 00:00:00</FECHA>
    <FOTO>C:\IMAGENES\KCHUNG.jpg</FOTO>
  </DATA_RECORD>
  <DATA_RECORD>
    <NICK_NAME>JDILLY</NICK_NAME>
    <NOMBRE>Jennifer Dilly</NOMBRE>
    <FECHA>2005/08/13 00:00:00</FECHA>
    <FOTO>C:\IMAGENES\JDILLY.jpg</FOTO>
  </DATA_RECORD>
  <DATA_RECORD>
    <NICK_NAME>TGATES</NICK_NAME>
    <NOMBRE>Timothy Gates</NOMBRE>
    <FECHA>2006/07/11 00:00:00</FECHA>
    <FOTO>C:\IMAGENES\TGATES.jpg</FOTO>
  </DATA_RECORD>
  <DATA_RECORD>
    <NICK_NAME>RPERKINS</NICK_NAME>
    <NOMBRE>Randall Perkins</NOMBRE>
    <FECHA>2007/12/19 00:00:00</FECHA>
    <FOTO>C:\IMAGENES\RPERKINS.jpg</FOTO>
  </DATA_RECORD>
  <DATA_RECORD>
    <NICK_NAME>SBELL</NICK_NAME>
    <NOMBRE>Sarah Bell</NOMBRE>
    <FECHA>2004/02/04 00:00:00</FECHA>
    <FOTO>C:\IMAGENES\SBELL.jpg</FOTO>
  </DATA_RECORD>
  <DATA_RECORD>
    <NICK_NAME>BEVERETT</NICK_NAME>
    <NOMBRE>Britney Everett</NOMBRE>
    <FECHA>2005/03/03 00:00:00</FECHA>
    <FOTO>C:\IMAGENES\BEVERETT.jpg</FOTO>
  </DATA_RECORD>
  <DATA_RECORD>
    <NICK_NAME>SMCCAIN</NICK_NAME>
    <NOMBRE>Samuel McCain</NOMBRE>
    <FECHA>2006/07/01 00:00:00</FECHA>
    <FOTO>C:\IMAGENES\SMCCAIN.jpg</FOTO>
  </DATA_RECORD>
  <DATA_RECORD>
    <NICK_NAME>VJONES</NICK_NAME>
    <NOMBRE>Vance Jones</NOMBRE>
    <FECHA>2007/03/17 00:00:00</FECHA>
    <FOTO>C:\IMAGENES\VJONES.jpg</FOTO>
  </DATA_RECORD>
  <DATA_RECORD>
    <NICK_NAME>AWALSH</NICK_NAME>
    <NOMBRE>Alana Walsh</NOMBRE>
    <FECHA>2006/04/24 00:00:00</FECHA>
    <FOTO>C:\IMAGENES\AWALSH.jpg</FOTO>
  </DATA_RECORD>
  <DATA_RECORD>
    <NICK_NAME>KFEENEY</NICK_NAME>
    <NOMBRE>Kevin Feeney</NOMBRE>
    <FECHA>2006/05/23 00:00:00</FECHA>
    <FOTO>C:\IMAGENES\KFEENEY.jpg</FOTO>
  </DATA_RECORD>
  <DATA_RECORD>
    <NICK_NAME>DOCONNEL</NICK_NAME>
    <NOMBRE>Donald OConnell</NOMBRE>
    <FECHA>2007/06/21 00:00:00</FECHA>
    <FOTO>C:\IMAGENES\DOCONNEL.jpg</FOTO>
  </DATA_RECORD>
  <DATA_RECORD>
    <NICK_NAME>DGRANT</NICK_NAME>
    <NOMBRE>Douglas Grant</NOMBRE>
    <FECHA>2008/01/13 00:00:00</FECHA>
    <FOTO>C:\IMAGENES\DGRANT.jpg</FOTO>
  </DATA_RECORD>
  <DATA_RECORD>
    <NICK_NAME>JWHALEN</NICK_NAME>
    <NOMBRE>Jennifer Whalen</NOMBRE>
    <FECHA>2003/09/17 00:00:00</FECHA>
    <FOTO>C:\IMAGENES\JWHALEN.jpg</FOTO>
  </DATA_RECORD>
  <DATA_RECORD>
    <NICK_NAME>MHARTSTE</NICK_NAME>
    <NOMBRE>Michael Hartstein</NOMBRE>
    <FECHA>2004/02/17 00:00:00</FECHA>
    <FOTO>C:\IMAGENES\MHARTSTE.jpg</FOTO>
  </DATA_RECORD>
  <DATA_RECORD>
    <NICK_NAME>PFAY</NICK_NAME>
    <NOMBRE>Pat Fay</NOMBRE>
    <FECHA>2005/08/17 00:00:00</FECHA>
    <FOTO>C:\IMAGENES\PFAY.jpg</FOTO>
  </DATA_RECORD>
  <DATA_RECORD>
    <NICK_NAME>SMAVRIS</NICK_NAME>
    <NOMBRE>Susan Mavris</NOMBRE>
    <FECHA>2002/06/07 00:00:00</FECHA>
    <FOTO>C:\IMAGENES\SMAVRIS.jpg</FOTO>
  </DATA_RECORD>
  <DATA_RECORD>
    <NICK_NAME>HBAER</NICK_NAME>
    <NOMBRE>Hermann Baer</NOMBRE>
    <FECHA>2002/06/07 00:00:00</FECHA>
    <FOTO>C:\IMAGENES\HBAER.jpg</FOTO>
  </DATA_RECORD>
  <DATA_RECORD>
    <NICK_NAME>SHIGGINS</NICK_NAME>
    <NOMBRE>Shelley Higgins</NOMBRE>
    <FECHA>2002/06/07 00:00:00</FECHA>
    <FOTO>C:\IMAGENES\SHIGGINS.jpg</FOTO>
  </DATA_RECORD>
  <DATA_RECORD>
    <NICK_NAME>WGIETZ</NICK_NAME>
    <NOMBRE>William Gietz</NOMBRE>
    <FECHA>2002/06/07 00:00:00</FECHA>
    <FOTO>C:\IMAGENES\WGIETZ.jpg</FOTO>
  </DATA_RECORD>
</main>
